аўтаномія	Кюрасао.	Аўтаномія	 не прадаецца 15 мая на карыбскім востраве Кюрасао адбыўся рэферэндум. Жыхары адмовілі былым каланіз
аўтаномія	ацыяй. Каб зразумець такі дзіўны факт, трэба згадаць, што з 1954 года Кюрасао карыстаецца ўнутранай	аўтаномія	й у складзе Каралеўства Нідэрланды. Пытанні знешняй палітыкі і абароны застаюцца ў кампетэнцыі Амстэ
аўтаномія	ацыяй. Каб зразумець такі дзіўны факт, трэба згадаць, што з 1954 года Кюрасао карыстаецца ўнутранай	аўтаномія	й у складзе Каралеўства Нідэрланды. Пытанні знешняй палітыкі і абароны застаюцца ў кампетэнцыі Амстэ
аўтаномія	ычанасць — 1,7 мільярда еўра. Цэнтр гатовы ўзяць на сябе даўгі, аднак толькі ў абмен на абмежаванне	аўтаноміі	. Менавіта гэтае пытанне — пагаджацца або не на продаж праў аўтаноміі — было вынесена на рэферэндум.
аўтаномія	 толькі ў абмен на абмежаванне аўтаноміі. Менавіта гэтае пытанне — пагаджацца або не на продаж праў	аўтаноміі	 — было вынесена на рэферэндум. Большасць прагаласавала супраць. На думку прыхільнікаў незалежнасці,
аўтаномія	етраў. У гэтым кантэксце востраў-курорт Кюрасао ператвараецца ў важны геапалітычны чыннік, і нейкая	аўтаномія	 тубыльцаў для інтарэсаў ЗША тут толькі перашкода. Па матэрыялах «NRS Handelsblat» (Нідэрланды)
