sens 1	Шырокая	аўтаномія	? Дзякуй, не трэба 10 студзеня жыхары двух французскіх заморскіх дэпартаментаў Марцініка і Гвіяна пр
sens 1	 жыхары двух французскіх заморскіх дэпартаментаў Марцініка і Гвіяна прагаласавалі супраць пашырэння	аўтаноміі	. Пра дзівосныя завіхрэнні французскага посткаланіялізму журналіст «НЧ» Алег Новікаў размаўляе з фра
sens 1	 жыхары двух французскіх заморскіх дэпартаментаў Марцініка і Гвіяна прагаласавалі супраць пашырэння	аўтаноміі	. Пра дзівосныя завіхрэнні французскага посткаланіялізму журналіст «НЧ» Алег Новікаў размаўляе з фра
sens 1	ячы з рэалій постсавецкай палітыкі, выбар жыхароў Марцінікі падаецца вельмі дзіўным. Статус шырокай	аўтаноміі	, як паказвае прыклад тых жа былых аўтаномных савецкіх рэспублік, дае большыя магчымасці для мясцова
sens 1	 — Які галоўны матыў такога выбару? — Каб зразумець, чаму большасць прагаласавала супраць пашырэння	аўтаноміі	, трэба вярнуцца ў мінулы год. Дакладней, прыгадаць вясну 2009 года, калі Марцініку ахапіла агульная
sens 1	авыя партыі, кшталту Нацыянальнага Фронту, і частка галістаў выступілі радыкальна супраць пашырэння	аўтаноміі	. Яны пабачылі ў гэтым замах на інстытуты французскай рэспублікі, для якой характэрны моцны цэнтралі
sens 1	арыжы законах. Такім правам карыстаюцца некалькі астравоў у Палінезіі. Менавіта такую форму шырокай	аўтаноміі	 хочуць аўтанамісты і прыхільнікі незалежнасці. Што тычыцца французскіх левых, то яны былі цалкам на
