аўтаномія	у вашых руках Новы Час Online ПалітыкаГрамадстваЭканомікаЗамежжаКультураПовязь часоўАсобаСпорт Відэа BUTTON Пошук Facebook TikTok Instagram Telegram Twitter Одноклассники YouTube У Маршы	аўтаноміі	Сілезіі прынялі ўдзел 4 тысячы чалавек button Падзяліцца ў Facebook button Падзяліцца ў Telegram button Падзяліцца ў Twitter button Падзяліцца
аўтаномія	ў Telegram button Падзяліцца ў Twitter button Падзяліцца ў VK Спасылка без VPN Замежжа14 07 2013 DEL DEL Марш прыхільнікаў	аўтаноміі	Сілезіі спрабавала сарваць група сябраў Лігі абароны суверэнітэту z9958310x 5 marsz autonomii slaska przeszedl glownymi ulicami jpg Па вуліцах сталіцы
аўтаномія	z9958310x 5 marsz autonomii slaska przeszedl glownymi ulicami jpg Па вуліцах сталіцы Верхняй Сілезіі гораду Катавіцы прайшло шэсце ў падтрымку	аўтаноміі	рэгіёну У маршы ўзялі ўдзел чатыры тысячы чалавек Удзельнікі шэсця неслі жоўта-блакітныя сцягі Верхняй Сілезіі транспаранты з надпісамі Аўтаномія 2020
аўтаномія	падтрымку аўтаноміі рэгіёну У маршы ўзялі ўдзел чатыры тысячы чалавек Удзельнікі шэсця неслі жоўта-блакітныя сцягі Верхняй Сілезіі транспаранты з надпісамі	Аўтаномія	2020 Сілезія як Баварыя І скандавалі Аўтаномія Верхняя Сілезія Мы верым што наш марш за аўтаномію Верхняй Сілезіі перарасце неўзабаве
аўтаномія	чатыры тысячы чалавек Удзельнікі шэсця неслі жоўта-блакітныя сцягі Верхняй Сілезіі транспаранты з надпісамі Аўтаномія 2020 Сілезія як Баварыя І скандавалі	Аўтаномія	Верхняя Сілезія Мы верым што наш марш за аўтаномію Верхняй Сілезіі перарасце неўзабаве ў супольны марш за Польшчу рэгіёнаў заявіў
аўтаномія	Сілезіі транспаранты з надпісамі Аўтаномія 2020 Сілезія як Баварыя І скандавалі Аўтаномія Верхняя Сілезія Мы верым што наш марш за	аўтаномію	Верхняй Сілезіі перарасце неўзабаве ў супольны марш за Польшчу рэгіёнаў заявіў на маршы старшыня Руху аўтаноміі Сілезіі Ежы Гажэлік Паводле
аўтаномія	што наш марш за аўтаномію Верхняй Сілезіі перарасце неўзабаве ў супольны марш за Польшчу рэгіёнаў заявіў на маршы старшыня Руху	аўтаноміі	Сілезіі Ежы Гажэлік Паводле арганізатараў у суботнім маршы ўзялі ўдзел прадстаўнікі іншых рэгіёнаў краіны Вялікапольшчы Падляшша і Памор'я Марш прыхільнікаў
аўтаномія	Сілезіі Ежы Гажэлік Паводле арганізатараў у суботнім маршы ўзялі ўдзел прадстаўнікі іншых рэгіёнаў краіны Вялікапольшчы Падляшша і Памор'я Марш прыхільнікаў	аўтаноміі	Сілезіі спрабавала сарваць група сябраў Лігі абароны суверэнітэту якая скандавала Ідзе пятая калона www radyjo net button Падзяліцца ў Facebook
аўтаномія	button Падзяліцца ў Facebook button Падзяліцца ў Telegram button Падзяліцца ў Twitter button Падзяліцца ў VK Спасылка без VPN Польшча	аўтаномія	Сілезія Катавіцы Шаноўныя чытачы Новы Час адно з нешматлікіх выданняў якое выдаецца цалкам на беларускай мове На жаль цяпер рэдакцыя
