1	10 пошук Аб кампаніі Model S Цеслы Электрамабілі Электрамабілі пратэставаныя пры 19ºC ніжэй за нуль Які з іх губляе большую	аўтаномію	Віктар Алёсь Юс sepelaci 7 Люты 2023 2 мін Электрамабілі пратэставаныя пры 19ºC ніжэй за нуль Які з іх губляе
1	Алёсь Юс sepelaci 7 Люты 2023 2 мін Электрамабілі пратэставаныя пры 19ºC ніжэй за нуль Які з іх губляе большую	аўтаномію	Адной з вялікіх праблем уладальнікаў электрамабіляў з'яўляецца страта аўтаномнасці ў халодным клімаце таму яны былі падвергнуты выпрабаванню ў Нарвегіі У
1	яны былі падвергнуты выпрабаванню ў Нарвегіі У нас зіма і гэта адна з самых вялікіх праблем для ўладальнікаў электрамабіляў страта	аўтаноміі	Холад ўплывае на працу акумулятара што прыводзіць да значнага зніжэння яго прадукцыйнасці І пры зарадцы і пры яздзе Па гэтай
1	Tesla Model S Правераная амерыканская мадэль адзначае меркаваны запас аўтаномнасці ў цыкле WLTP у 634 кіламетры але чакалася значнае скарачэнне	аўтаноміі	У рэшце рэшт менавіта гэтая мадэль вылучалася вышэй за ўсіх чым здолела ахапіць да 530 кіламетраў з зарадам батарэі Тэст
1	з-за якой вы можаце страціць некалькі кіламетраў падчас тэсту Выпрабаванне тэмпературы было у сярэднім 19ºC і нават пры гэтым зніжэнне	аўтаноміі	было ацэнена на 16 менш чым тое што пазначана як афіцыйная аўтаномія Добры запіс які нягледзячы на добры характар не
1	у сярэднім 19ºC і нават пры гэтым зніжэнне аўтаноміі было ацэнена на 16 менш чым тое што пазначана як афіцыйная	аўтаномія	Добры запіс які нягледзячы на добры характар не быў лепшым у агульным вымярэнні Электрамабіль які лепш за ўсё адрэагаваў на
1	Toyota bZ4x Запас ходу гэтай мадэлі складае 503 кіламетры але яна здолела праехаць усяго 323 кіламетры Гэта азначае што страта	аўтаноміі	склала 35 Іншыя атрыманыя вынікі паказваюць што Skoda Enyaq Coupe RS у-эль- Mercedes EQE 300 Яны адзначылі зніжэнне аўтаноміі паміж
1	страта аўтаноміі склала 35 Іншыя атрыманыя вынікі паказваюць што Skoda Enyaq Coupe RS у-эль- Mercedes EQE 300 Яны адзначылі зніжэнне	аўтаноміі	паміж 20 і 30 Каб правесці тэст вадзіцелі прайшлі маршрут які пачынаўся ў Осла і павінен быў трымайцеся ніжэй абмежаванняў
