аўтаномнасьць	Якой будзе	аўтаномнасць	 у Porsche Taycan? Гэта тое, што мы ведаем Апошнія выявы, апублікаваныя Porsche, выклікалі здагадкі
аўтаномнасьць	aycan? Гэта тое, што мы ведаем Апошнія выявы, апублікаваныя Porsche, выклікалі здагадкі аб рэальнай	аўтаномнасці	 Taycan. Аднак важна ўлічваць некаторыя меркаванні На мінулым тыдні кампанія Porsche апублікавала не
аўтаномнасьць	і з'яўляецца ў пачатку гэтага запісу, мы ўбачым, што экран цэнтральнай кансолі Taycan паказвае, што	аўтаномнасць	 аўтамабіля складае 286 км пры 75-працэнтным зарадзе акумулятара. Гэтая інфармацыя выклікае некаторы
аўтаномнасьць	 ў сацыяльных сетках, паколькі, выкарыстоўваючы простае правіла трох, гэта азначала б, што Агульная	аўтаномнасць	 Taycan складзе каля 382 км. Лічба значна ніжэйшая за тую, што прапануюць некаторыя яе канкурэнты. У
аўтаномнасьць	азволіць больш рухомую і спартыўную язду, што лагічна будзе азначаць большае спажыванне і паменшыць	аўтаномнасць	 аўтамабіля. Такім чынам, гэтыя 382 км аўтаномнасці з акумулятарам, зараджаным на 100 працэнтаў, - г
аўтаномнасьць	на будзе азначаць большае спажыванне і паменшыць аўтаномнасць аўтамабіля. Такім чынам, гэтыя 382 км	аўтаномнасці	 з акумулятарам, зараджаным на 100 працэнтаў, - гэта тое, што мы можам праехаць з рэжымам спорт выбр
аўтаномнасьць	йце, у гэтым рэжыме задні спойлер будзе цалкам апушчаны каб максімальна паменшыць супраціў паветра.	Аўтаномнасць	 Taycan павінна складаць каля 500 км Такім чынам, з адной з версій Taycan з акумулятарам на 96 кВт·г
