sens 1	Ураджайнасць Простае самаспажыванне Самаспажыванне перапродаж лішкаў у сетку Поўная перапродаж у сетку Эканомце на рахунках Grid Аўтаномнасць Самаспажыванне Сетка Поўная	аўтаномія	Для ПЛЮСАЎ user count актыўныя карыстальнікі 8 289 SIMULATIONS RÉALISÉES HIER 3 008 289 SIMULATIONS CUMULÉES user count актыўныя карыстальнікі
sens 1	самаспажыванне Самаспажыванне перапродаж лішкаў у сетку Поўная перапродаж у сетку Эканомце на рахунках Grid Аўтаномнасць Самаспажыванне Сетка Толькі сетка Поўная	аўтаномія	Для ПЛЮСАЎ Пацвердзіце інфармацыю профілю Перш чым працягнуць пацвердзіце некаторую інфармацыю профілю BUTTON Пацвердзіць Я хачу працаваць больш эфектыўна і
sens 1	атрымліваеце неадкладны доступ да фінансавага мадэлявання BUTTON РЭГІСТРАЦЫЯ ЗАРАЗ Вы ўпэўнены што хочаце адлучыцца BUTTON Адмяніць BUTTON ВЫЙСЦІ Мадэляванне поўнай	аўтаноміі	па-за сеткай Сімулятары прапанаваныя на PVGIS COM таксама распрацаваны каб задаволіць разнастайныя патрабаванні прафесіяналаў як асобы ў сектары сонечнай энергіі
sens 1	ніжэй на англійскай мове Ваша ўласная справаздача будзе створана аўтаматычна на мове якую вы абралі ў наладах акаўнта Мадэляванне поўнай	аўтаноміі	Спампаваць узор PDF Visual 1 Visual 2 Сонечная радыяцыя і фотаэлектрычная вытворчасць будуць адрознівацца калі ёсць мясцовыя пагоркі або горы
sens 1	прапануе некалькі пераваг для аналізу і прыняцце рашэнняў асабліва ў кантэксце энергетыкі аптымізацыя Visual 14 Гэты аналіз ілюструе гіпотэзу энергетычнай	аўтаноміі	для вытворчай пляцоўкі на аснове агульнага спажывання уласнага спажывання і аўтаноміі якую забяспечвае сістэма Ацэнка спажывання энергіі Разлічваецца месячнае і
sens 1	энергетыкі аптымізацыя Visual 14 Гэты аналіз ілюструе гіпотэзу энергетычнай аўтаноміі для вытворчай пляцоўкі на аснове агульнага спажывання уласнага спажывання і	аўтаноміі	якую забяспечвае сістэма Ацэнка спажывання энергіі Разлічваецца месячнае і сутачнае спажыванне каб зразумець энергетычныя патрэбы сайта за пэўны перыяд Разлік
sens 1	спажывання Энергія мясцовай вытворчасці і непасрэднага спажывання самаспажыванне ацэньваецца для ацэнкі долі вытворчасці якая выкарыстоўваецца не абапіраючыся на сетка Энергетычная	аўтаномія	Патэнцыял аўтаноміі вырабленая і спажываная энергія на месцы разлічваецца ў кВт гадз за кожны месяц што адлюстроўвае здольнасць сістэмы паменшыць
sens 1	мясцовай вытворчасці і непасрэднага спажывання самаспажыванне ацэньваецца для ацэнкі долі вытворчасці якая выкарыстоўваецца не абапіраючыся на сетка Энергетычная аўтаномія Патэнцыял	аўтаноміі	вырабленая і спажываная энергія на месцы разлічваецца ў кВт гадз за кожны месяц што адлюстроўвае здольнасць сістэмы паменшыць залежнасць ад
sens 1	ў кВт гадз за кожны месяц што адлюстроўвае здольнасць сістэмы паменшыць залежнасць ад сеткі Такі падыход дапамагае вымераць узровень энергетычнай	аўтаноміі	дасягнуты фотаэлектрычнай сістэмай пры вызначэнні месяцаў у якіх аптымізуецца ўласнае спажыванне і аўтаномнасць што дазваляе прымаць рашэнні для павышэння агульнай
sens 1	рознымі ёмістасці каб ацаніць іх гадавы энергетычны ўклад і адпаведнасць патрэбам Ёмістасць і штомесячная даступнасць Ёмістасць акумулятара параўноўваецца з неабходная	аўтаномія	кожны месяц каб ацаніць іх энергазабеспячэнне Агульнае гадавое спажыванне Энергія якую забяспечвае кожная батарэя на працягу аднаго года перыяд разлічваецца
sens 1	батарэя дасягае свайго максімуму ёмістасць або рэшткі недастаткова выкарыстаны Такі падыход дапамагае падбіраць батарэі ў адпаведнасці з рэальнымі патрэбамі балансуючы	аўтаномія	і аптымізацыя рэсурсаў Visual 17 У гэтай табліцы параўноўваецца ўплыў рознай ёмістасці акумулятара на энергетычную аўтаномію кошт сеткі і штогадовыя
sens 1	з рэальнымі патрэбамі балансуючы аўтаномія і аптымізацыя рэсурсаў Visual 17 У гэтай табліцы параўноўваецца ўплыў рознай ёмістасці акумулятара на энергетычную	аўтаномію	кошт сеткі і штогадовыя зберажэнні Акумулятары з большай ёмістасцю забяспечваюць лепшую эканомію і далейшае зніжэнне залежнасць ад сеткі але патрабуе
sens 2	Падпіска Мадэляванне PDF PVGIS24 Ураджайнасць Простае самаспажыванне Самаспажыванне перапродаж лішкаў у сетку Поўная перапродаж у сетку Эканомце на рахунках Grid	Аўтаномнасць	Самаспажыванне Сетка Поўная аўтаномія Для ПЛЮСАЎ user count актыўныя карыстальнікі 8 289 SIMULATIONS RÉALISÉES HIER 3 008 289 SIMULATIONS CUMULÉES
sens 2	Падпіска Мадэляванне PDF PVGIS24 Ураджайнасць Простае самаспажыванне Самаспажыванне перапродаж лішкаў у сетку Поўная перапродаж у сетку Эканомце на рахунках Grid	Аўтаномнасць	Самаспажыванне Сетка Толькі сетка Поўная аўтаномія Для ПЛЮСАЎ Пацвердзіце інфармацыю профілю Перш чым працягнуць пацвердзіце некаторую інфармацыю профілю BUTTON Пацвердзіць
sens 2	сеткі Такі падыход дапамагае вымераць узровень энергетычнай аўтаноміі дасягнуты фотаэлектрычнай сістэмай пры вызначэнні месяцаў у якіх аптымізуецца ўласнае спажыванне і	аўтаномнасць	што дазваляе прымаць рашэнні для павышэння агульнай прадукцыйнасці Visual 15 Гэты аналіз абапіраецца на метад ацэнкі прадукцыйнасці батарэй з рознымі
sens 2	з'яўляюцца яны нізкагабарытнымі або вялікімі Гэты метад накіраваны на правільны памер акумулятараў каб максымізаваць эфектыўнасць пазбягаючы марнавання энергіі або недастатковая	аўтаномнасць	Visual 16 Аналіз спажывання акумулятараў на аснове іх ёмістасці і штомесячных патрэбаў у энергіі абапіраецца на Разлік энергазабеспячэння Мы ацэньваем
