sens 1		Аўтаномія	 (ад грэч. autonomia ад autos - сам + nomos - закон), самастойнае ажыццяўленне дзяржаўнай улады ці к
sens 1	 былым СССР існавала 20 аўтаномных рэспублік (АССР), 18 аўтаномных абласцей і акруг. Яны мелі формы	аўтаноміі	: палітычную ці адміністрацыйную. Палітычная аўтаномія надавалася аўтаномным рэспублікам, якія з'яўл
sens 1	8 аўтаномных абласцей і акруг. Яны мелі формы аўтаноміі: палітычную ці адміністрацыйную. Палітычная	аўтаномія	 надавалася аўтаномным рэспублікам, якія з'яўляліся нацыянальнымі дзяржавамі, мелі свае канстытуцыі,
sens 1	 канстытуцыі, вышэйшыя органы дзяржаўнай улады і кіравання, уласнае грамадзянства. Адміністрацыйная	аўтаномія	 надавалася аўтаномным абласцям і акругам (лічыліся нацыянальна-тэрытарыяльнымі ўтварэннямі, а не дз
sens 1	таномных акруг і аўтаномная жыдоўская вобласць. Беларусь аўтаномных адзінак не мае. У розных формах	аўтаномія	 ажыццяўляецца і ў іншых краінах свету (напрыклад, у Вялікабрытаніі, Швейцарыі) і надаецца, як праві
sens 1	ентальнасці, эканамічнага, палітычнага і культурнага развіцця. Існуе таксама нацыянальна-культурная	аўтаномія	 - свабоднае, самастойнае функцыянаванне і развіццё нацыянальных культур асобных этнічных супольнасц
sens 1	а пражывання нацыянальных меншасцей дзейнічалі нацыянальныя сельскія і местачковыя Саветы з правамі	аўтаноміі	: 23 польскія, 23 жыдоўскія, 16 расейскіх, 5 латышскіх, 2 украінскія і 2 нямецкія нацыянальныя савет
sens 1	асопісы, газеты на мовах нацыянальных меншасцей. У канцы 1930-х г. усе формы нацыянальна-культурнай	аўтаноміі	 ў БССР перасталі існаваць. Іх адраджэнне пачалося ў канцы 1980-х г. Створаны Саюз палякаў Беларусі,
