аўтаномія	папярэдні пост. Разам з усёй гэтай афіцыйнай інфармацыяй выявы, апублікаваныя Porsche, выклікалі здагадкі аб некаторых характарыстыках Taycan, сярод іх сваю	аўтаномію.	Калі мы паглядзім на малюнак, які з'яўляецца ў пачатку гэтага запісу, мы ўбачым, што экран цэнтральнай кансолі Taycan паказвае, што
аўтаномія	мы можам праехаць з рэжымам спорт выбраны. Але мы не павінны забываць, што, калі мы хочам атрымаць асалоду ад большай	аўтаноміі,	ёсць два іншых рэжыму -Range y нармальны- што, безумоўна, Яны дазволяць нам пайсці значна далей. Нам давядзецца пачакаць да 4-га
аўтаномнасьць	Якой будзе	аўтаномнасць	у Porsche Taycan? Гэта тое, што мы ведаем Апошнія выявы, апублікаваныя Porsche, выклікалі здагадкі аб рэальнай аўтаномнасці Taycan. Аднак важна
аўтаномнасьць	Якой будзе аўтаномнасць у Porsche Taycan? Гэта тое, што мы ведаем Апошнія выявы, апублікаваныя Porsche, выклікалі здагадкі аб рэальнай	аўтаномнасці	Taycan. Аднак важна ўлічваць некаторыя меркаванні На мінулым тыдні кампанія Porsche апублікавала некалькі малюнкаў Яны дазволілі дэталёва разгледзець салон новага
аўтаномнасьць	Калі мы паглядзім на малюнак, які з'яўляецца ў пачатку гэтага запісу, мы ўбачым, што экран цэнтральнай кансолі Taycan паказвае, што	аўтаномнасць	аўтамабіля складае 286 км пры 75-працэнтным зарадзе акумулятара. Гэтая інфармацыя выклікае некаторыя спрэчкі ў сацыяльных сетках, паколькі, выкарыстоўваючы простае правіла
аўтаномнасьць	зарадзе акумулятара. Гэтая інфармацыя выклікае некаторыя спрэчкі ў сацыяльных сетках, паколькі, выкарыстоўваючы простае правіла трох, гэта азначала б, што Агульная	аўтаномнасць	Taycan складзе каля 382 км. Лічба значна ніжэйшая за тую, што прапануюць некаторыя яе канкурэнты. Усяму ёсць тлумачэнне Тым не
аўтаномнасьць	вынікае з яго назвы, гэты рэжым дазволіць больш рухомую і спартыўную язду, што лагічна будзе азначаць большае спажыванне і паменшыць	аўтаномнасць	аўтамабіля. Такім чынам, гэтыя 382 км аўтаномнасці з акумулятарам, зараджаным на 100 працэнтаў, - гэта тое, што мы можам праехаць
аўтаномнасьць	больш рухомую і спартыўную язду, што лагічна будзе азначаць большае спажыванне і паменшыць аўтаномнасць аўтамабіля. Такім чынам, гэтыя 382 км	аўтаномнасці	з акумулятарам, зараджаным на 100 працэнтаў, - гэта тое, што мы можам праехаць з рэжымам спорт выбраны. Але мы не
аўтаномнасьць	таго, як пракаментавана відэа апублікаваныя Цалкам зараджайце, у гэтым рэжыме задні спойлер будзе цалкам апушчаны каб максімальна паменшыць супраціў паветра.	Аўтаномнасць	Taycan павінна складаць каля 500 км Такім чынам, з адной з версій Taycan з акумулятарам на 96 кВт·г і з
