аўтаномія	Рада Бясьпекі ААН пачала разглядаць новую заяўку Палестынскай	аўтаноміі	 аб прыняцьці ў сябры ААН, піша «Голас Амэрыкі». Спачатку яе разгледзіць спэцыяльны Камітэт Рады Бяс
аўтаномія	ць, што пытаньне палестынскай дзяржаўнасьці павінна вырашацца ў выніку перамоваў паміж палестынскай	аўтаномія	й і Ізраілем. Ванэса Фрэйзэр, пастаянная прадстаўніца Мальты, якая ў гэтым месяцы зьяўляецца старшын
аўтаномія	ясьпекі, паведаміла журналістам, што Рада Бясьпекі будзе займацца разглядам сяброўства Палестынскай	аўтаноміі	 ў ААН у красавіку. Напярэдадні Камітэт Рады Бясьпекі па прыняцьці новых членаў у ААН правёў пасяджэ
аўтаномія	сьпекі праз генэральнага сакратара ААН заяўку аб прыняцьці ў ААН, — сказаў прадстаўнік Палестынскай	аўтаноміі	 пры ААН Рыяд Мансур. — Тады быў гістарычны момант, і сёньня ён паўтараецца. Мы шчыра спадзяёмся, шт
аўтаномія	юбівых дзяржаў! Сябры, цалкам відавочна, што палестынцы не адпавядаюць гэтаму крытэру. Палестынская	аўтаномія	 зусім не кантралюе Газу, не кантралюе значных часткак Юдэі і Самарыі, дзе цэлыя раёны і нават гарад
аўтаномія	бе прычына, каб адмовіць палестынцам ва ўзнагародзе за іхны агідны тэрарызм. Ды і саму Палестынскую	аўтаномію	 наўрад ці можна назваць „міралюбівай“». Заяўка Палестынскай аўтаноміі ў 2011 годзе была адхілена, б
аўтаномія	арызм. Ды і саму Палестынскую аўтаномію наўрад ці можна назваць „міралюбівай“». Заяўка Палестынскай	аўтаноміі	 ў 2011 годзе была адхілена, бо, паводле паведамленьняў дыпляматаў, яна не атрымала неабходнай падтр
