аўтаномнасьць	навігацыі Электрычны Тэсты Тэхнічныя лісты Топ 10 пошук Аб кампаніі BMW i7 Салоны Электрамабілі Згодна з EPA BMW i516 забяспечвае	аўтаномнасць	да 7 км Хаўер Кантагалі 17 снежня 2023 3 мін Згодна з EPA BMW i516 забяспечвае аўтаномнасць да 7 км
аўтаномнасьць	BMW i516 забяспечвае аўтаномнасць да 7 км Хаўер Кантагалі 17 снежня 2023 3 мін Згодна з EPA BMW i516 забяспечвае	аўтаномнасць	да 7 км BMW i7 гэта вялікі і даволі цяжкі седан які аднак забяспечвае добрую аўтаномнасць дзякуючы акумулятарнай батарэі якой
аўтаномнасьць	EPA BMW i516 забяспечвае аўтаномнасць да 7 км BMW i7 гэта вялікі і даволі цяжкі седан які аднак забяспечвае добрую	аўтаномнасць	дзякуючы акумулятарнай батарэі якой ён абсталяваны ёмістасцю больш за 100 кВт гадз Элітны электрычны седан баварскага вытворцы даступны на паўночнаамерыканскім
аўтаномнасьць	з'яўляецца вялікім і даволі цяжкім седанам які такім чынам патрабуе акумулятарнай батарэі значнай ёмістасці каб быць у стане прапанаваць добрая	аўтаномнасць	Такім чынам баварскі вытворца абраў для аснашчэння аднаго з 105 7 кВт г агульная ёмістасць якія застаюцца на ўзроўні 101
аўтаномнасьць	ўзроўні 101 7 карысных кВт гадз з якімі можна праехаць нават больш за 300 міль 482 км- на адной зарадцы	Аўтаномнасць	EPA 3 даступных версій BMW i7 Як і чакалася самая даступная версія eDrive50 абсталяваная адным электрычным рухавіком гэта тая якая
аўтаномнасьць	даступных версій BMW i7 Як і чакалася самая даступная версія eDrive50 абсталяваная адным электрычным рухавіком гэта тая якая прапануе большую	аўтаномнасць	Згодна з EPA калі на гэтай версіі ўстаноўлены 19-цалевыя колы Яго аўтаномнасць дасягае 321 міль 516 км- Аднак калі выбраныя
аўтаномнасьць	адным электрычным рухавіком гэта тая якая прапануе большую аўтаномнасць Згодна з EPA калі на гэтай версіі ўстаноўлены 19-цалевыя колы Яго	аўтаномнасць	дасягае 321 міль 516 км- Аднак калі выбраныя колы маюць памер 20 цаляў запас ходу паменшыцца на 6 2 працэнта
аўтаномнасьць	працэнта застаючыся на даволі рэспектабельных 301 міль 484 км- Нарэшце і насуперак таму што можна было чакаць з 21-цалевымі коламі	Аўтаномнасць	некалькі большая дасягаючы 311 міль 500 км- паколькі шыны абсталяваныя такімі дыскамі па-відаць даюць меншы супраціў качэнню Bmw I7 M70
аўтаномнасьць	Што робіць апошні найбольш прыдатным варыянтам для гэтай версіі як з пункту гледжання знешняга выгляду так і прадукцыйнасці а таксама	аўтаномнасці	Zeekr прадстаўляе акумулятар LFP з хуткай зарадкай Zeekr presenta su batería LFP con carga rápida Zeekr прадстаўляе акумулятар LFP з
