аўтаномнасьць	мадэлі Фіхас Тэсты Кіраўніцтва па куплі Караванінг параўнаць Камерцыйныя электрамабілі FIAT PROFESSIONAL Mercedes-Benz eSprinter ключы да новага электрычнага фургона з	аўтаномнасцю	да 478 км 23 красавіка 2024 Антоніа Ронсэра Няма каментарыяў Mercedes-Benz падымае планку сваім новым eSprinter які прапануецца з двума
аўтаномнасьць	Паколькі з прапановай якая ўключае два тыпы кузава з дзвюма даўжынямі два варыянты магутнасці і да трох ёмістасцей батарэі з	Аўтаномнасць	зацверджаная ў цыкле WLTP складае ад 233 да 478 км цяжка не знайсці версію якая найлепшым чынам адпавядае любому бізнесу
аўтаномнасьць	камеры і дадзеных навігацыйнай сістэмы Акрамя таго кіроўца можа выбіраць паміж трыма рэжымамі працы камфортным эканамічным і праграмай для максімальнай	аўтаномнасці	Тры ёмістасці батарэі аўтаномнасць да 478 км Акумулятар новага Mercedes-Benz eSprinter тып LFP фасфат літый-жалеза якія паводле маркі больш прыдатныя
аўтаномнасьць	сістэмы Акрамя таго кіроўца можа выбіраць паміж трыма рэжымамі працы камфортным эканамічным і праграмай для максімальнай аўтаномнасці Тры ёмістасці батарэі	аўтаномнасць	да 478 км Акумулятар новага Mercedes-Benz eSprinter тып LFP фасфат літый-жалеза якія паводле маркі больш прыдатныя чым кобальт і нікель
аўтаномнасьць	для прымянення ў камерцыйных аўтамабілях бо маюць вялікую даўгавечнасць Вы можаце выбраць адзін з трох акумулятараў з рознай ёмістасцю і	аўтаномнасцю	хоць прамежкавы не будзе даступны на момант запуску і паступіць у верасні Акумулятар 56 кВт г з да 233 км
аўтаномнасьць	MBUX ад Mercedes-Benz з'яўляецца часткай стандартнага абсталявання новага eSprinter і па жаданні можа быць абсталявана разумны навігатар які актыўна кіруе	аўтаномнасцю	разлічваючы маршрут аптымізаваным спосабам і з улікам неабходных зарадных прыпынкаў на аснове рэальных даных аб дарожным руху і схемы маршруту
аўтаномнасьць	аўтамабілі 2024 Espacio Furgo Усе захаваныя правы пошук BUTTON Запытаць цану аўтамабіля Mercedes-Benz eSprinter ключы да новага электрычнага фургона з	аўтаномнасцю	да 478 км Імя E-mail Тэлефон BUTTON Запыт параўнаць
