аўтаномія	). І гэта дасягае 136 XNUMX еўра за eSprinter XNUMX з XNUMX HP і батарэяй, якая забяспечвае большую	аўтаномію	, усе цэны без падаткаў і транспарту. Цэны ў баку, гэта ключы ад новага электрычнага фургона Mercede
аўтаномія	будзе даступны на момант запуску, і паступіць у верасні: - Акумулятар 56 кВт * г, з да 233 км дэ	аўтаномія	 - Акумулятар 81 кВт * г, з да 329 км дэ аўтаномія - Акумулятар 113 кВт * г, з
аўтаномія	кВт * г, з да 233 км дэ аўтаномія - Акумулятар 81 кВт * г, з да 329 км дэ	аўтаномія	 - Акумулятар 113 кВт * г, з да 478 км дэ аўтаномія Акумулятар мае актыўную сістэму кіравання тэмпер
аўтаномія	кВт * г, з да 329 км дэ аўтаномія - Акумулятар 113 кВт * г, з да 478 км дэ	аўтаномія	 Акумулятар мае актыўную сістэму кіравання тэмпературай і цеплавой помпа, што спрыяе павышэнню эфект
аўтаномнасьць	ўключае два тыпы кузава з дзвюма даўжынямі, два варыянты магутнасці і да трох ёмістасцей батарэі, з	Аўтаномнасць	, зацверджаная ў цыкле WLTP, складае ад 233 да 478 км, цяжка не знайсці версію, якая найлепшым чынам
аўтаномнасьць	оўца можа выбіраць паміж трыма рэжымамі працы: камфортным, эканамічным і праграмай для максімальнай	аўтаномнасці	. Тры ёмістасці батарэі, аўтаномнасць да 478 км Акумулятар новага Mercedes-Benz eSprinter - тып LFP
аўтаномнасьць	мі працы: камфортным, эканамічным і праграмай для максімальнай аўтаномнасці. Тры ёмістасці батарэі,	аўтаномнасць	 да 478 км Акумулятар новага Mercedes-Benz eSprinter - тып LFP (фасфат літый-жалеза), якія, паводле
аўтаномнасьць	х, бо маюць вялікую даўгавечнасць. Вы можаце выбраць адзін з трох акумулятараў з рознай ёмістасцю і	аўтаномнасцю	, хоць прамежкавы не будзе даступны на момант запуску, і паступіць у верасні: - Акумулятар 56 кВт *
аўтаномнасьць	сталявання новага eSprinter і па жаданні можа быць абсталявана разумны навігатар, які актыўна кіруе	аўтаномнасцю	, разлічваючы маршрут аптымізаваным спосабам і з улікам неабходных зарадных прыпынкаў на аснове рэал
