аўтаномія	ай кар'еры. Аўтаномнасць, моцны бок пазадарожніка Электрычны энергаблок ст Kona Electric дазваляе а	аўтаномія	 чагосьці больш за 482 кіламетраў у адпаведнасці з цыкл wltp. Тым не менш, гэта павялічваецца нават
аўтаномія	кае выданне 613 кіламетраў, у той час як французская газета распаўсюджвалася да 734,4 кіламетраў іх	аўтаномія	. Абодва часопісы ажыццявілі гэтыя туры с толькі адна поўная зарадка. Hyundai Kona: электрамабіль го
аўтаномнасьць	Hyundai Kona Electric: узнагароджаны за	аўтаномнасць	 і суадносіны кошту і якасці Hyundai Kona Electric быў названы «Электрычным аўтамабілем года» часопі
аўтаномнасьць	моманту выхаду на рынак летам 2018 г. розныя аўтамабільныя часопісы і гала станоўча ацанілі вялікая	аўтаномнасць	 і суадносіны кошту і якасці Дэль Hyundai Kona Electric. Азіяцкі пазадарожнік, другі цалкам электрыф
аўтаномнасьць	ы аўтамабіль паўднёвакарэйскага брэнда, мае a вялікая колькасць узнагарод у сваёй кароткай кар'еры.	Аўтаномнасць	, моцны бок пазадарожніка Электрычны энергаблок ст Kona Electric дазваляе а аўтаномія чагосьці больш
аўтаномнасьць	чыць яе адной з моцных бакоў паўднёвакарэйскага пазадарожніка. Першае выпрабаванне для праверкі яго	аўтаномнасці	 адбылося падчас Парыжскі салон. Падарожнічалі двое журналістаў і пяць аўтамабіляў Hyundai Kona Elec
аўтаномнасьць	у Вялікабрытаніі. Нарэшце, розныя часопісы, такія як Аўтабілд y Карыдызіяк Яны таксама пратэставалі	аўтаномнасць	 пазадарожніка. Паспела дадаць нямецкае выданне 613 кіламетраў, у той час як французская газета расп
аўтаномнасьць	зіяцкі пазадарожнік не перастае атрымліваць прызнанне за згаданыя вышэй суадносіны кошту і якасці і	аўтаномнасць	. Першы, у ліпені 2018 г., у в Auto Express New Car Awards. Мадэль Hyundai абышла Nissan Leaf і Volk
аўтаномнасьць	Car Awards 2019 узнагароджаны як «Лепшы экалагічна аўтамабіль» - электрычнай мадэлі азіяцкай маркі.	Аўтаномнасць	, карыснасць, дызайн і даступны кошт сталі прычынамі прызначэння яго пераможцам. Акрамя таго, Пражск
