аўтаномнасьць	У наступным годзе Hyundai павялічыць	аўтаномнасць	 электрычнага Ioniq Аўтаномнасць Ioniq можа дасягаць 300 км з новым акумулятарам ёмістасцю каля 39 к
аўтаномнасьць	У наступным годзе Hyundai павялічыць аўтаномнасць электрычнага Ioniq	Аўтаномнасць	 Ioniq можа дасягаць 300 км з новым акумулятарам ёмістасцю каля 39 кВт/г. Калі электрычны Hyundai Io
аўтаномнасьць	цца, то, несумненна, таму яго незвычайная эфектыўнасць. Толькі з батарэяй 28 кВт * г Ён карыстаецца	аўтаномнасцю	, такой жа, як у іншых канкурэнтаў з батарэяй большай ёмістасці, дзякуючы нізкаму спажыванню. Мала т
аўтаномнасьць	 значнай колькасці патэнцыйных пакупнікоў. Менавіта па гэтай прычыне Hyundai плануе павялічыць сваю	аўтаномнасць	 у наступным годзе. Большая аўтаномнасць, але не дасягаючы Kona з батарэяй на 64 кВт.гадз Нядаўна гэ
аўтаномнасьць	ў. Менавіта па гэтай прычыне Hyundai плануе павялічыць сваю аўтаномнасць у наступным годзе. Большая	аўтаномнасць	, але не дасягаючы Kona з батарэяй на 64 кВт.гадз Нядаўна гэта пацвердзіў Гіл Касціла, стратэгічны м
аўтаномнасьць	i па альтэрнатыўных аўтамабілях. Па яго ўласных словах, новы электрычны Ioniq значна палепшыць сваю	аўтаномнасць	, хаця і не дасягаючы таго, што прапануе Kona EV. Нагадаем, апошні даступны з акумулятарнай батарэяй
аўтаномнасьць	асцю 39.2 і 64 кВт/г, што дазваляе праязджаць на адной зарадцы да 470 км. Hyundai плануе павялічыць	аўтаномнасць	 акумулятара ў наступным годзе, верагодна, у другім паўгоддзі, у абноўленай версіі, якая таксама мож
аўтаномнасьць	а нарэшце пацвердзіла павелічэнне ёмістасці акумулятара да 39 кВт/г, Здаецца цалкам верагодным, што	аўтаномнасць	 гэтай новай версіі перавышае 300 км. Такім чынам, ён будзе на адным узроўні з большасцю сваіх канку
