2	com ns html id GTM-MGNRFSQ BUTTON Дысплей навігацыі ініцыяванне Устойлівасць Хогар мабільнасць Smart City пошук Аб кампаніі Паўпрычэпы Цеслы Трэнеры	Аўтаномнасць	Tesla Semi складзе 1000 км на адной зарадцы Хаўер Кантагалі Cantagalli 29 Лістапад 2020 2 мін Аўтаномнасць Tesla Semi складзе
2	Паўпрычэпы Цеслы Трэнеры Аўтаномнасць Tesla Semi складзе 1000 км на адной зарадцы Хаўер Кантагалі Cantagalli 29 Лістапад 2020 2 мін	Аўтаномнасць	Tesla Semi складзе 1000 км на адной зарадцы Гэтым паведамленнем Ілон Маск смяецца ў твар скептыкам якія сумняваюцца ў мэтазгоднасці
2	да Tesla Semi яе першага электрамабіля прызначанага для перавозкі грузаў па дарозе Маск пакінуў дзіўны загаловак паколькі як ён сцвярджае	аўтаномнасць	Tesla Semi разам з нагрузкай якую ён нясе мог дасягнуць 1000 км Так вы правільна прачыталі тысяча кіламетраў У апошнія
2	км Так вы правільна прачыталі тысяча кіламетраў У апошнія гады на этапе распрацоўкі Tesla Semi Ілон Маск ужо каментаваў што	аўтаномнасць	будзе адной з яго моцных бакоў з моманту выпрабаванняў праведзеных кампаніяй Яны давалі нават лепшыя вынікі чым чакалася шчыльнасць энергіі
2	Tesla Semi Elon Tesla Semi Elon У 2017 годзе калі Tesla Semi быў афіцыйна прадстаўлены Ілон Маск запэўніў што яго	аўтаномнасць	складзе ад 300 да 500 міль прычым дзве версіі будуць каштаваць 150 тысяч і 180 тысяч долараў адпаведна Аднак праз
2	СМІ прысвечаных электрычнай мабільнасці Tesla Semi не мае чаго пазайздросціць звычайнаму грузавіку Падчас інтэрв'ю Маск заявіў што дасягненне 500 км	аўтаномнасці	з Tesla Semi не ўяўляе для кампаніі ніякай праблемы гэта сапраўды лёгка Улічваючы яшчэ і тое што ён нясе груз
2	што ён нясе груз у 40 тон Дасягненне 800 км таксама магчыма і нават здаецца магчымым што праз кароткі час	аўтаномнасць	Tesla Semi дасягне 1000 км запэўніў ён Інтэр'ер Tesla Semi Tesla Semi Interior Гаворачы аб агульнай вазе нагрузкі якую зможа
