аўтаномнасьць		Аўтаномнасць	Tesla Semi складзе 1000 км на адной зарадцы Гэтым паведамленнем Ілон Маск смяецца ў твар скептыкам, якія сумняваюцца ў мэтазгоднасці
аўтаномнасьць	да Tesla Semi, яе першага электрамабіля, прызначанага для перавозкі грузаў па дарозе. Маск пакінуў дзіўны загаловак, паколькі, як ён сцвярджае,	аўтаномнасць	Tesla Semi - разам з нагрузкай, якую ён нясе - мог дасягнуць 1000 км. Так, вы правільна прачыталі, тысяча кіламетраў.
аўтаномнасьць	км. Так, вы правільна прачыталі, тысяча кіламетраў. У апошнія гады, на этапе распрацоўкі Tesla Semi, Ілон Маск ужо каментаваў, што	аўтаномнасць	будзе адной з яго моцных бакоў; з моманту выпрабаванняў, праведзеных кампаніяй Яны давалі нават лепшыя вынікі, чым чакалася.. «шчыльнасць энергіі»,
аўтаномнасьць	прадстаўленыя Tesla падчас мерапрыемства. Дзень батарэйкі. У 2017 годзе, калі Tesla Semi быў афіцыйна прадстаўлены, Ілон Маск запэўніў, што яго	аўтаномнасць	складзе ад 300 да 500 міль, прычым дзве версіі будуць каштаваць 150 тысяч і 180 тысяч долараў адпаведна. Аднак праз
аўтаномнасьць	СМІ, прысвечаных электрычнай мабільнасці. Tesla Semi не мае чаго пазайздросціць звычайнаму грузавіку Падчас інтэрв'ю Маск заявіў, што дасягненне 500 км	аўтаномнасці	з Tesla Semi не ўяўляе для кампаніі ніякай праблемы, гэта сапраўды лёгка. Улічваючы яшчэ і тое, што ён нясе груз
аўтаномнасьць	што ён нясе груз у 40 тон. Дасягненне 800 км таксама магчыма, і нават здаецца магчымым, што праз кароткі час	аўтаномнасць	Tesla Semi дасягне 1000 км, запэўніў ён. Гаворачы аб агульнай вазе нагрузкі, якую зможа несці Tesla Semi, Маск перакананы, што
