자율	육청, "미래교육 모델" 제시 현장중심, 교사중심 정책 연구 '미래교육' [데일리경기신문 = 김경원 기자] 화성오산교육지원청은 푸르미르에서 ‘2025 화성오산 미래교육 페스타(학교	자율	과제×디지털토핑교육) 성과나눔회’를 성황리에 개최했다고 3일 밝혔다. 이번 행사는 유치원·초등학교·각 학교급 특수교육이 함께 참여하는 미래교육 통합 플랫폼으로, 학교자율과제의 우수
자율	페스타(학교자율과제×디지털토핑교육) 성과나눔회’를 성황리에 개최했다고 3일 밝혔다. 이번 행사는 유치원·초등학교·각 학교급 특수교육이 함께 참여하는 미래교육 통합 플랫폼으로, 학교	자율	과제의 우수사례와 디지털토핑 정책연구 결과를 한자리에서 공유했다. 교육지원청은 ‘디지털토핑교육’은 학습자가 디지털 콘텐츠를 자유롭게 선택·조합해 '개별 맞춤형 학습 경험을 설계하는
자율	모았다. 행사 1부는 유·초·특 대표 연구팀이 디지털 시민성, AI기반 학습, 게이미피케이션 수업 등 현장에서 검증된 실천형 연구결과를 발표했고, 2부는 학교	자율	과제 우수 운영 사례 공유를 통해 학교 자율성과 전문성 기반의 미래교육 실천 방향을 제시했다. 이번 11개 부스 체험에서는 ▲생성형 AI기반
자율	디지털 시민성, AI기반 학습, 게이미피케이션 수업 등 현장에서 검증된 실천형 연구결과를 발표했고, 2부는 학교자율과제 우수 운영 사례 공유를 통해 학교	자율	성과 전문성 기반의 미래교육 실천 방향을 제시했다. 이번 11개 부스 체험에서는 ▲생성형 AI기반 퀴즈 개발 ▲AI서·논술형 평가 설계 ▲게이미피케이션 플랫폼(카훗·김킷
자율	김인숙 화성오산교육지원청 교육장은 “화성오산 디지털 토핑교육은 현장 중심·교사 중심 정책연구가 미래교육 정책으로 연결되는 전국적 모델이 될 것”이라며 “학생의 개별성과 학교의	자율	성이 존중받는 미래교육을 위해 교육지원청이 지속적으로 지원하겠다”고 강조했다. 한편, 화성오산교육지원청은 앞으로도 미래교육 역량 강화·학교자율과제 내실화·AI 기반 학습 생태 구축
자율	 것”이라며 “학생의 개별성과 학교의 자율성이 존중받는 미래교육을 위해 교육지원청이 지속적으로 지원하겠다”고 강조했다. 한편, 화성오산교육지원청은 앞으로도 미래교육 역량 강화·학교	자율	과제 내실화·AI 기반 학습 생태 구축을 통해 현장 중심으로 한 정책 실천 일반화를 이어갈 예정이다.
