자립	일을 하고 계셨다. 활보 일을 하면서 시설, 즉 장애인 복지원에서 나온 사람들을 여럿 보았다. 그들은 시설을 나와서 사는 것을 ‘	자립	 생활’이라고 불렀다. 이렇게 여러 사람들을 만나면서 나는 시설이라는 공간이 매우 궁금해졌다. 그리고 탈시설과 자립 생활의 의미 역시 관심이 생겼다.
자립	보았다. 그들은 시설을 나와서 사는 것을 ‘자립 생활’이라고 불렀다. 이렇게 여러 사람들을 만나면서 나는 시설이라는 공간이 매우 궁금해졌다. 그리고 탈시설과	자립	 생활의 의미 역시 관심이 생겼다. 그래서 이 주제에 관심이 많은 몇몇 연구실 친구들과 함께 장애학 세미나를 하며 ‘수용소’를 테마로
자립	여러 가지 질문들이 우리를 괴롭혔다. 그러나 시설을 경험해보지 못한 우리와 시설을 경험한 사람들을 묶어주는 하나의 연결고리가 있었으니 그것이 바로 ‘	자립	생활’이었다. 한달 전부터 새로운 활보 이용자 분을 담당하게 되었다. 이 분과 일하면서 곤란한 것은 그분의 장애가 아니다. 오히려 이용자의 성격이
자립	달라붙어 있는 시설적 태도, 우리의 삶을 외부에 의탁해버리고 편안히 살아가려는 그 모든 태도를 떼어내고 또 떼어내는 길밖에는 없다. 진정한 '	자립	'은 내 것이 아닌 결정들을 떼어내고 또 떼어내는 수 밖에 없다! 글_민경 '활·보 활보(闊步)' 카테고리의 다른 글 | [활보활보] 여유롭게
자립	2016.05.06 | |---|---| | 더 나은 삶이란게 뭘까? 장애를 꼭 결핍으로만 보아야 할까? (2) | 2016.04.08 | | [활보활보] 진정한	자립	 - 자립에 필요한 것은 바로 '근기' (0) | 2016.02.19 | | 나 혼자 '잘' 산다? 자립의 두 얼굴 -
자립	|---|---| | 더 나은 삶이란게 뭘까? 장애를 꼭 결핍으로만 보아야 할까? (2) | 2016.04.08 | | [활보활보] 진정한 자립 -	자립	에 필요한 것은 바로 '근기' (0) | 2016.02.19 | | 나 혼자 '잘' 산다? 자립의 두 얼굴 - 자유와 권태
자립	| | [활보활보] 진정한 자립 - 자립에 필요한 것은 바로 '근기' (0) | 2016.02.19 | | 나 혼자 '잘' 산다?	자립	의 두 얼굴 - 자유와 권태 사이 (4) | 2015.12.04 | | 서로의 다름을 알아가는 '진정한' 활보가 되는 과정 (4)
