자율	한양대학교 기계공학부 오기용 교수 연구팀의 ‘Physical AI 기반 송전설비	자율	 점검 기술’ 관련 연구가 스마트 인프라 분야 세계적 학술지 『Computer-Aided Civil and Infrastructure Engineering(CACIE, IF 9.1
자율	해결하기 위해서는 설비 구조와 주변 환경을 스스로 파악하고, 상황에 따라 비행·관측 위치를 조정하며 점검까지 수행할 수 있는 Physical AI 기반	자율	 점검 기술이 필요했다. Physical AI는 실제 환경의 물리적 특성을 해석하고 스스로 판단하는 차세대 지능기술로, 복잡한 산업 시설의 점검 자동화를
자율	자율 점검 기술이 필요했다. Physical AI는 실제 환경의 물리적 특성을 해석하고 스스로 판단하는 차세대 지능기술로, 복잡한 산업 시설의 점검 자동화를	자율	화로 확장할 수 있는 핵심 기술로 평가된다. 오기용 교수 연구팀은 이러한 산업적 요구에 대응해 송전설비를 실시간으로 인지·추정하며 비행, 접근, 점검
자율	오기용 교수 연구팀은 이러한 산업적 요구에 대응해 송전설비를 실시간으로 인지·추정하며 비행, 접근, 점검 판단까지 수행하는 세계 최초의 Physical AI 기반	자율	 점검 기술을 개발했다. 연구팀은 멀티모달 센서 기반 환경 인지, UAV 제어, 점검 알고리즘을 통합한 자율 점검 체계를 구현해 인간
자율	세계 최초의 Physical AI 기반 자율 점검 기술을 개발했다. 연구팀은 멀티모달 센서 기반 환경 인지, UAV 제어, 점검 알고리즘을 통합한	자율	 점검 체계를 구현해 인간 개입 없이 송전설비를 탐색하고 진단할 수 있도록 했다. 특히 제안된 자율비행 기술은 GPS 신호 없이도
자율	UAV 제어, 점검 알고리즘을 통합한 자율 점검 체계를 구현해 인간 개입 없이 송전설비를 탐색하고 진단할 수 있도록 했다. 특히 제안된	자율	비행 기술은 GPS 신호 없이도 송전설비 분석만으로 비행 자세를 안정적으로 유지해 전자기장 간섭이 강한 송전선로 환경에서도 안정적 점검이 가능하다. 또한
자율	-Aided Civil and Infrastructure Engineering』(IF=9.1, JCR Top 0.8%)에 2024년과 2025년에 연속 게재됐다. 첫 번째 연구인	자율	비행 기술 논문 「Autonomous flight strategy of an unmanned aerial vehicle with multimodal information for a
