otonomi	irliği; mevcut projeleri başarıyla tamamlama, kritik teknoloji bağımlılıklarını aşma ve yapay zekâ,	otonomi	, siber güvenlik ve uzay gibi geleceğin harp alanlarına stratejik yatırımlar yapma kapasitesine bağl
otonomi	erasyonel kapasiteye ulaştığında, Türkiye’nin hava savunması konusundaki pazarlık gücü ve stratejik	otonomi	si köklü bir şekilde değişecektir. Milli Hava Savunma Sistemleri Yetenek Özeti 4.4. Stratejik Ufuk:
otonomi	ları yerde bırakamayacağını garanti altına alacaktır. 5.3. Geleceğin Doktrinleri: Ağ Merkezli Harp,	Otonomi	 ve Yapay Zeka Türkiye, sadece modern platformlar üretmekle kalmayıp, bu platformları geleceğin sava
otonomi	 Loop) hızlandırarak rakibe karşı ezici bir tempo üstünlüğü kurmayı hedefler. - Sürü Teknolojisi ve	Otonomi	: Geleceğin muharebe alanında tekil ve pahalı platformlar yerine, çok sayıda, daha ucuz ve otonom si
otonomi	 projelerin tamamlanmasıyla elde edilecek tam bağımsızlık, gelişen ihracat pazarları ve yapay zeka,	otonomi	, hipersonik sistemler gibi yeni teknolojilerde öncü olma potansiyeli, Türkiye’nin önündeki en büyük
otonomi	endirilmesi teşvik edilmelidir. - Geleceğin Teknolojilerine ve Doktrinlerine Odaklanma: Yapay zeka,	otonomi	, siber, uzay, yönlendirilmiş enerji ve hipersonik sistemler gibi geleceğin harp alanlarına yönelik
özerklik	lli gemisavar füzesi ATMACA gibi yerli silah sistemleriyle donatılarak, vuruş gücünde tam stratejik	özerklik	 sağlayacaktır. 3.4. Otonom Donanma: ULAQ, SANCAR ve MARLIN SİDA’ları Türkiye, İHA’lardaki öncülüğün
özerklik	 işbirlikleri kurulmuştur. Motor bağımsızlığı, Türkiye’nin savunma sanayii ihracatının ve stratejik	özerkliği	nin “kilidini açacak” anahtardır. Milli motorlara sahip olmak, hem ihracat pazarlarındaki engelleri
