özerklik	siyasal atmosfere göre nasıl yorumlanıp manüple edildiğini gördük. Osman Baydemir, partisinin programında yer alan, kamuoyuna daha önce sunulmuş, bilinen demokratik	özerklik	görüşünü anlatıyor. BDP'nin "Türkiye'nin Siyasi İdari Yapısında Reform ve Kürt Sorununda Çözüm Modeli Taslağı"'nda demokratik özerklik, bölge meclislerinin oluşturulduğu, yerinden
özerklik	önce sunulmuş, bilinen demokratik özerklik görüşünü anlatıyor. BDP'nin "Türkiye'nin Siyasi İdari Yapısında Reform ve Kürt Sorununda Çözüm Modeli Taslağı"'nda demokratik	özerklik,	bölge meclislerinin oluşturulduğu, yerinden yönetim ilkesiyle, "Bayrak" ve "Resmi Dil"in tüm ulusta geçerli olurken her bölgenin kendi renk ve sembolleriyle
özerklik	tarafından da onaylanmış programında yer alan partisinin görüşlerini aktarıyor, burada sorun ne olabilir ki? Lakin önce bir kısım medya "Baydemir	özerklik	istedi" diye manşet yapıyor, sonra hükümet sözcüsü Cemil Çiçek, hoş olmayan ifadelerle bir yıl önce başlayan açılım politikasının gereklerini yerine
özerklik	alıyoruz? Cehaletin üzeri korkularla örtülüyor. Özerk demokratik yerel yönetimlerin kurulması için başka ne yapılabilir? 1988 yılında hazırlanan Avrupa Yerel Yönetimler	Özerklik	Şartnamesi, 8 Mayıs 1991 tarihinde TBMM'de kabul ediliyor. Kabul edilirken de özerklikle ilgili maddelerine çekince konuluyor. Eğer AKP hükümeti, Avrupa
özerklik	ne yapılabilir? 1988 yılında hazırlanan Avrupa Yerel Yönetimler Özerklik Şartnamesi, 8 Mayıs 1991 tarihinde TBMM'de kabul ediliyor. Kabul edilirken de	özerklikle	ilgili maddelerine çekince konuluyor. Eğer AKP hükümeti, Avrupa Yerel Yönetimler Özerklik Şartnamesi'ne konulan çekinceleri kaldırırsa özerk bölge yönetimleri kurulabilir. Ya
özerklik	Mayıs 1991 tarihinde TBMM'de kabul ediliyor. Kabul edilirken de özerklikle ilgili maddelerine çekince konuluyor. Eğer AKP hükümeti, Avrupa Yerel Yönetimler	Özerklik	Şartnamesi'ne konulan çekinceleri kaldırırsa özerk bölge yönetimleri kurulabilir. Ya da Fransa gibi Avrupa Birliği'nin şartnamesine ihtiyaç olmadan, anayasasında gerekli düzenleme
özerklik	gerekli düzenleme yaparak özerk demokratik yerel yönetimleri kurabilir. (İP/TK) (1) Kayıkçı S., Reform Yasası Sonrası Fransa'da Yerel Yönetimler ve Yerel	Özerklik	Şartı, 1982
