özerklik	kendi yapısını koruyacaktır. Bu nedenle, Avrupa devletlerinin göstermelik olarak imzaladıkları ama sıra kendilerine geldiği zaman kesinlikle uygulamadıkları Avrupa Yerel Yönetimler	Özerklik	Şartının uygulamaya geçirilmesini, dost ve müttefik görünümlü düşmanların Türkiye’den beklemeleri gerçeklere ters düşmektedir. Türkiye Cumhuriyeti, Yugoslavya gibi sonradan oluşturulan bir
özerklik	güç merkezi olduğu artık iyice ortaya çıkmıştır. Kimse bu gerçeği görmezden gelerek kendini aldatmasın ve Türk devletinin de Yugoslavya benzeri	özerklik	masalları ile uyutularak tasfiye edileceği umutlarına kapılmasın. Dünya devlerine karşı verilen bir ulusal kurtuluş savaşı ile ortaya çıkan Türkiye Cumhuriyeti
özerklik	kurtuluş savaşı ile ortaya çıkan Türkiye Cumhuriyeti gerekirse Türk halkının vereceği yeni bir ulusal kurtuluş mücadelesi ile yoluna devam edebilecektir.	Özerklik	kavramının bölünme, parçalanma ve dağılma anlamına geldiği artık kesinleşmiştir. Bu durumda, Türkiye’nin ulus devletten eyalet devletçiklerine kaydırma projesi olan özerklik
özerklik	Özerklik kavramının bölünme, parçalanma ve dağılma anlamına geldiği artık kesinleşmiştir. Bu durumda, Türkiye’nin ulus devletten eyalet devletçiklerine kaydırma projesi olan	özerklik	oyununa gelmeyeceği açıktır. Özerklik olmaz ama toplumsal gereksinmeler doğrultusunda, yerel yönetimlerin güçlendirilmesi ve bazı alanlarda yetkilerinin genişletilmesi, ulusal-üniter-merkezi yapıyı bozmayacak
özerklik	ve dağılma anlamına geldiği artık kesinleşmiştir. Bu durumda, Türkiye’nin ulus devletten eyalet devletçiklerine kaydırma projesi olan özerklik oyununa gelmeyeceği açıktır.	Özerklik	olmaz ama toplumsal gereksinmeler doğrultusunda, yerel yönetimlerin güçlendirilmesi ve bazı alanlarda yetkilerinin genişletilmesi, ulusal-üniter-merkezi yapıyı bozmayacak düzeyde yeni yasal düzenlemeler
özerklik	korunabilmesi açısından sakıncalar yaratabilir. Bu nedenle, yerel yönetimlerin güçlendirilmesi ve ihtiyaç duyulan bazı alanlarda yetkilerinin genişletilmesi yasal düzenlemeler çerçevesinde yapılmalıdır.	Özerklik	olmayacak ama yerel yönetimlerin yetkilerinin artırılması yolu ile güçlendirilmesi ülkenin gereksinmeleri doğrultusunda sağlanacaktır. Bu nedenle mandacı, işbirlikçi ve bölücüler korosunun
özerklik	olmayacak ama yerel yönetimlerin yetkilerinin artırılması yolu ile güçlendirilmesi ülkenin gereksinmeleri doğrultusunda sağlanacaktır. Bu nedenle mandacı, işbirlikçi ve bölücüler korosunun	özerklik	şarkılarına artık bir son vermeleri gerekmektedir. - ROMALILARIN ANKARA ANITI - 26 Mayıs 2025 - KAMUSAL CUMHURİYET Mİ YOKSA KARŞI
